{
  "backend": "tensorrt",
  "benchmark": null,
  "compile": {
    "error": null,
    "ms": null,
    "ok": false
  },
  "created_at": "2026-09-16T16:37:34.523192+00:00",
  "model": {
    "kind": "fixture",
    "path": "/home/theatulgupta/LLM-Neural-Compiler/fixtures/tiny_cnn.onnx"
  },
  "run_id": "e686b8f0-48aa-4137-88f4-2a856a627001",
  "schema_version": 1,
  "skip": {
    "backend": "tensorrt",
    "reason": "no NVIDIA device: nvidia-smi not on PATH and /dev/nvidia0 missing (this host is aarch64 QEMU with a Virtio GPU)"
  }
}
